{
 "schema_version": 1,
 "builder": "builder_primary",
 "commit": "4b825dc642cb6eb9a060e54bf8d69288fbee4904",
 "tree_hash": "9d45962efcf863c3befa0b39d5748ede2ae5870e",
 "iterations": 2,
 "unchecked": [
  "web/app.ts"
 ],
 "headers_missing": [
  "web/app.ts"
 ],
 "lemmas": [
  {
   "name": "lemma_media_nonneg",
   "status": "pass"
  },
  {
   "name": "lemma_new",
   "status": "no_pair"
  }
 ],
 "dependency_changes": [
  {
   "ecosystem": "go",
   "name": "github.com/example/yaml",
   "allowed": true
  }
 ]
}
